{
  "schema": "https://opendataproducts.org/odpv-v1.0/schema/odpv.schema.json",
  "version": "1.0.0",
  "id": "ODPV",
  "name": {
    "en": "Open Data Product Vocabulary"
  },
  "description": {
    "en": "Shared vocabulary for the OpenDataProducts.org standards family."
  },
  "license": {
    "name": "Apache 2.0",
    "url": "https://www.apache.org/licenses/LICENSE-2.0"
  },
  "publisher": {
    "name": "Open Data Product Initiative",
    "umbrella": "Linux Foundation",
    "url": "https://opendataproducts.org"
  },
  "sections": [
    {
      "id": "core",
      "name": {
        "en": "ODPV Core"
      },
      "description": {
        "en": "Foundational terms used across the Open Data Products specification family."
      },
      "terms": [
        {
          "id": "DataProduct",
          "uri": "https://opendataproducts.org/odpv-v1.0/terms/DataProduct",
          "type": "object",
          "status": "stable",
          "introducedIn": "1.0.0",
          "preferredLabel": {
            "en": "Data Product"
          },
          "definition": {
            "en": "A managed data offering designed for reuse, with defined ownership, access, quality, usage terms, and value context."
          },
          "alsoKnownAs": {
            "en": [
              "data product",
              "data offering",
              "reusable data asset",
              "data product asset"
            ]
          },
          "relatedTerms": [
            "Dataset",
            "DataService",
            "Distribution"
          ],
          "usedIn": [
            "ODPS",
            "ODPC",
            "ODPG"
          ],
          "examples": {
            "en": [
              "Customer Churn Risk Scores is a DataProduct used by retention teams.",
              "Use DataProduct for a managed reusable data offering with ownership, access, quality, and usage context."
            ]
          }
        },
        {
          "id": "ProductDetails",
          "uri": "https://opendataproducts.org/odpv-v1.0/terms/ProductDetails",
          "type": "object",
          "status": "stable",
          "introducedIn": "1.0.0",
          "preferredLabel": {
            "en": "Product Details"
          },
          "definition": {
            "en": "The descriptive metadata block for a data product, including name, product identifier, description, value proposition, visibility, status, and version."
          },
          "alsoKnownAs": {
            "en": [
              "details",
              "product details",
              "product metadata",
              "descriptive metadata"
            ]
          },
          "relatedTerms": [
            "DataProduct",
            "ValueProposition",
            "GovernanceProfile",
            "PortfolioPriority"
          ],
          "usedIn": [
            "ODPS"
          ],
          "examples": {
            "en": [
              "The Details section of an ODPS product contains its name, identifier, value proposition, visibility, status, and version.",
              "Use ProductDetails for the descriptive metadata block of a data product."
            ]
          }
        },
        {
          "id": "DataProductCatalog",
          "uri": "https://opendataproducts.org/odpv-v1.0/terms/DataProductCatalog",
          "type": "object",
          "status": "stable",
          "introducedIn": "1.0.0",
          "preferredLabel": {
            "en": "Data Product Catalog"
          },
          "definition": {
            "en": "A managed collection of data products and related portfolio objects, such as use cases, objectives, KPIs, signals, and references."
          },
          "alsoKnownAs": {
            "en": [
              "data catalog",
              "Catalog",
              "ODPC Catalog",
              "product catalog",
              "data product portfolio",
              "portfolio catalog"
            ]
          },
          "relatedTerms": [
            "DataProduct",
            "DataProductGraph",
            "Reference"
          ],
          "usedIn": [
            "ODPC",
            "ODPG"
          ],
          "examples": {
            "en": [
              "The enterprise data marketplace is a DataProductCatalog containing reusable data products and related portfolio objects.",
              "In ODPC, the root Catalog object maps to the ODPV DataProductCatalog term.",
              "Use DataProductCatalog when describing a managed collection of products, use cases, objectives, KPIs, and signals."
            ]
          }
        },
        {
          "id": "DataProductGraph",
          "uri": "https://opendataproducts.org/odpv-v1.0/terms/DataProductGraph",
          "type": "object",
          "status": "stable",
          "introducedIn": "1.0.0",
          "preferredLabel": {
            "en": "Data Product Graph"
          },
          "definition": {
            "en": "A graph representation that connects data products, catalogs, use cases, objectives, KPIs, signals, and governance objects through defined relationships."
          },
          "alsoKnownAs": {
            "en": [
              "data product graph",
              "portfolio graph",
              "knowledge graph",
              "product relationship graph"
            ]
          },
          "relatedTerms": [
            "DataProductCatalog",
            "Reference",
            "Relationship"
          ],
          "usedIn": [
            "ODPG"
          ],
          "examples": {
            "en": [
              "A DataProductGraph connects customer analytics products to use cases, KPIs, owners, and policies.",
              "Use DataProductGraph when data product portfolio objects need to be represented as connected nodes and relationships."
            ]
          }
        },
        {
          "id": "Dataset",
          "uri": "https://opendataproducts.org/odpv-v1.0/terms/Dataset",
          "type": "object",
          "status": "stable",
          "introducedIn": "1.0.0",
          "preferredLabel": {
            "en": "Dataset"
          },
          "definition": {
            "en": "A structured collection of data that may be part of, or exposed through, a data product. Aligns with DCAT where applicable."
          },
          "alsoKnownAs": {
            "en": [
              "data set",
              "data collection",
              "source dataset",
              "data resource"
            ]
          },
          "relatedTerms": [
            "DataProduct",
            "Distribution",
            "DataService"
          ],
          "usedIn": [
            "ODPS",
            "ODPC"
          ],
          "examples": {
            "en": [
              "The monthly customer transactions table is a Dataset used by a Customer Analytics DataProduct.",
              "Use Dataset for a structured collection of data, not for the managed product wrapper around it."
            ]
          }
        },
        {
          "id": "Distribution",
          "uri": "https://opendataproducts.org/odpv-v1.0/terms/Distribution",
          "type": "object",
          "status": "stable",
          "introducedIn": "1.0.0",
          "preferredLabel": {
            "en": "Distribution"
          },
          "definition": {
            "en": "A specific accessible form of a dataset, such as a file, API response, export, or downloadable representation. Aligns with DCAT where applicable."
          },
          "alsoKnownAs": {
            "en": [
              "data file",
              "data download",
              "export",
              "data representation"
            ]
          },
          "relatedTerms": [
            "Dataset",
            "DataService",
            "DataAccess"
          ],
          "usedIn": [
            "ODPS"
          ],
          "examples": {
            "en": [
              "A downloadable CSV export is a Distribution of a Dataset.",
              "Use Distribution for a specific accessible representation such as a file, API response, or export."
            ]
          }
        },
        {
          "id": "DataService",
          "uri": "https://opendataproducts.org/odpv-v1.0/terms/DataService",
          "type": "object",
          "status": "stable",
          "introducedIn": "1.0.0",
          "preferredLabel": {
            "en": "Data Service"
          },
          "definition": {
            "en": "A service that provides access to data or data operations, such as an API, query endpoint, or data delivery service. Aligns with DCAT where applicable."
          },
          "alsoKnownAs": {
            "en": [
              "data API",
              "API",
              "data endpoint",
              "query service",
              "delivery service"
            ]
          },
          "relatedTerms": [
            "Dataset",
            "Distribution",
            "DataAccess",
            "API"
          ],
          "usedIn": [
            "ODPS",
            "ODPG"
          ],
          "examples": {
            "en": [
              "A REST API that returns fraud risk scores is a DataService.",
              "In ODPG graphs, an API node maps to the ODPV DataService term.",
              "Use DataService for an API, query endpoint, or delivery service that provides access to data."
            ]
          }
        },
        {
          "id": "Agent",
          "uri": "https://opendataproducts.org/odpv-v1.0/terms/Agent",
          "type": "role",
          "status": "stable",
          "introducedIn": "1.0.0",
          "preferredLabel": {
            "en": "Agent"
          },
          "definition": {
            "en": "An AI agent, automation actor, or software system that can use data products, services, workflows, or graph context to perform a task."
          },
          "alsoKnownAs": {
            "en": [
              "AI agent",
              "automation actor",
              "autonomous agent",